{"id":"file:000000005e1a7001","schemaVersion":1,"sport":"swimming","subSport":"lap_swimming","name":"SYNTHETIC pool 800m","startTime":"2026-01-19T11:30:00Z","timezoneOffsetMin":-300,"elapsedTimeS":861.1,"movingTimeS":741.1,"distanceM":800.0,"avgHr":136,"maxHr":147,"poolLengthM":25.0,"hasGps":false,"channels":["heartRate","speed","distance","cadence"],"source":{"provider":"file","format":"fit","device":"synthetic","importedAt":"2026-02-01T00:00:00Z"},"samples":{"t":[22.4,42.4,66.0,88.5,107.2,129.8,154.1,176.7,206.7,233.0,257.5,281.7,306.8,336.8,358.6,381.3,403.2,424.3,446.7,469.7,491.7,513.5,543.5,569.7,596.2,622.6,651.2,681.2,703.9,727.9,750.1,771.7,793.6,816.5,839.1,861.1],"channels":{"heartRate":[112,122,129,134,138,141,143,145,125,131,136,139,142,122,129,134,138,141,143,145,146,147,127,133,137,140,143,123,130,135,139,141,144,145,146,147],"speed":[1.114,1.252,1.059,1.111,1.337,1.108,1.03,1.106,0.0,0.949,1.019,1.035,0.995,0.0,1.147,1.104,1.14,1.185,1.114,1.09,1.134,1.145,0.0,0.956,0.944,0.946,0.873,0.0,1.105,1.042,1.126,1.155,1.144,1.092,1.104,1.135],"distance":[25.0,50.0,75.0,100.0,125.0,150.0,175.0,200.0,200.0,225.0,250.0,275.0,300.0,300.0,325.0,350.0,375.0,400.0,425.0,450.0,475.0,500.0,500.0,525.0,550.0,575.0,600.0,600.0,625.0,650.0,675.0,700.0,725.0,750.0,775.0,800.0],"cadence":[45.5,54.1,43.2,45.3,51.3,47.9,42.0,42.5,null,29.6,34.2,37.2,38.2,null,46.8,42.4,46.5,48.3,48.1,47.1,46.3,49.5,null,36.7,31.7,34.1,33.5,null,47.7,42.5,43.2,47.1,43.9,41.9,45.1,43.6]}},"pauses":[],"laps":[{"index":0,"startT":0.0,"endT":176.7,"movingTimeS":176.7,"distanceM":200.0,"trigger":"manual","intensity":"active"},{"index":1,"startT":206.7,"endT":306.8,"movingTimeS":100.2,"distanceM":100.0,"trigger":"manual","intensity":"active"},{"index":2,"startT":336.8,"endT":513.5,"movingTimeS":176.7,"distanceM":200.0,"trigger":"manual","intensity":"active"},{"index":3,"startT":543.5,"endT":651.2,"movingTimeS":107.7,"distanceM":100.0,"trigger":"manual","intensity":"active"},{"index":4,"startT":681.2,"endT":861.1,"movingTimeS":179.9,"distanceM":200.0,"trigger":"manual","intensity":"active"}],"swimLengths":[{"index":0,"startT":0.0,"endT":22.4,"strokes":17,"stroke":"freestyle","idle":false},{"index":1,"startT":22.4,"endT":42.4,"strokes":18,"stroke":"freestyle","idle":false},{"index":2,"startT":42.4,"endT":66.0,"strokes":17,"stroke":"freestyle","idle":false},{"index":3,"startT":66.0,"endT":88.5,"strokes":17,"stroke":"freestyle","idle":false},{"index":4,"startT":88.5,"endT":107.2,"strokes":16,"stroke":"freestyle","idle":false},{"index":5,"startT":107.2,"endT":129.8,"strokes":18,"stroke":"freestyle","idle":false},{"index":6,"startT":129.8,"endT":154.1,"strokes":17,"stroke":"freestyle","idle":false},{"index":7,"startT":154.1,"endT":176.7,"strokes":16,"stroke":"freestyle","idle":false},{"index":8,"startT":176.7,"endT":206.7,"stroke":"unknown","idle":true},{"index":9,"startT":206.7,"endT":233.0,"strokes":13,"stroke":"backstroke","idle":false},{"index":10,"startT":233.0,"endT":257.5,"strokes":14,"stroke":"backstroke","idle":false},{"index":11,"startT":257.5,"endT":281.7,"strokes":15,"stroke":"backstroke","idle":false},{"index":12,"startT":281.7,"endT":306.8,"strokes":16,"stroke":"backstroke","idle":false},{"index":13,"startT":306.8,"endT":336.8,"stroke":"unknown","idle":true},{"index":14,"startT":336.8,"endT":358.6,"strokes":17,"stroke":"freestyle","idle":false},{"index":15,"startT":358.6,"endT":381.3,"strokes":16,"stroke":"freestyle","idle":false},{"index":16,"startT":381.3,"endT":403.2,"strokes":17,"stroke":"freestyle","idle":false},{"index":17,"startT":403.2,"endT":424.3,"strokes":17,"stroke":"freestyle","idle":false},{"index":18,"startT":424.3,"endT":446.7,"strokes":18,"stroke":"freestyle","idle":false},{"index":19,"startT":446.7,"endT":469.7,"strokes":18,"stroke":"freestyle","idle":false},{"index":20,"startT":469.7,"endT":491.7,"strokes":17,"stroke":"freestyle","idle":false},{"index":21,"startT":491.7,"endT":513.5,"strokes":18,"stroke":"freestyle","idle":false},{"index":22,"startT":513.5,"endT":543.5,"stroke":"unknown","idle":true},{"index":23,"startT":543.5,"endT":569.7,"strokes":16,"stroke":"breaststroke","idle":false},{"index":24,"startT":569.7,"endT":596.2,"strokes":14,"stroke":"breaststroke","idle":false},{"index":25,"startT":596.2,"endT":622.6,"strokes":15,"stroke":"breaststroke","idle":false},{"index":26,"startT":622.6,"endT":651.2,"strokes":16,"stroke":"breaststroke","idle":false},{"index":27,"startT":651.2,"endT":681.2,"stroke":"unknown","idle":true},{"index":28,"startT":681.2,"endT":703.9,"strokes":18,"stroke":"freestyle","idle":false},{"index":29,"startT":703.9,"endT":727.9,"strokes":17,"stroke":"freestyle","idle":false},{"index":30,"startT":727.9,"endT":750.1,"strokes":16,"stroke":"freestyle","idle":false},{"index":31,"startT":750.1,"endT":771.7,"strokes":17,"stroke":"freestyle","idle":false},{"index":32,"startT":771.7,"endT":793.6,"strokes":16,"stroke":"freestyle","idle":false},{"index":33,"startT":793.6,"endT":816.5,"strokes":16,"stroke":"freestyle","idle":false},{"index":34,"startT":816.5,"endT":839.1,"strokes":17,"stroke":"freestyle","idle":false},{"index":35,"startT":839.1,"endT":861.1,"strokes":16,"stroke":"freestyle","idle":false}]}
